{
  "tieu_de": "CÁC DẠNG BÀI TẬP VÀ ĐỀ MINH HOẠ",
  "thong_tin": {
    "mon": "Khoa học tự nhiên",
    "lop": 6,
    "chu_de_chung": "Chủ đề: Mở đầu về Khoa học tự nhiên và Đa dạng chất, các thể của chất"
  },
  "cau_hinh": {
    "muc_do": [
      { "ma": "NB", "ten": "Nhận biết" },
      { "ma": "TH", "ten": "Thông hiểu" },
      { "ma": "VD", "ten": "Vận dụng" },
      { "ma": "LH", "ten": "Liên hệ thực tế" }
    ]
  },

  "muc_tieu": [
    {
      "chu_de": "Chủ đề 1. Mở đầu về Khoa học tự nhiên",
      "yeu_cau": [
        { "muc_do": "NB", "noi_dung": "Nêu được khái niệm khoa học tự nhiên; nhận ra được đối tượng nghiên cứu của khoa học tự nhiên là các sự vật, hiện tượng và quy luật của thế giới tự nhiên." },
        { "muc_do": "NB", "noi_dung": "Trình bày được các lĩnh vực chủ yếu của khoa học tự nhiên: Vật lí, Hoá học, Sinh học, Thiên văn học, Khoa học Trái Đất." },
        { "muc_do": "NB", "noi_dung": "Nêu được các quy định an toàn khi học trong phòng thực hành; nhận biết được ý nghĩa của một số kí hiệu cảnh báo." },
        { "muc_do": "NB", "noi_dung": "Trình bày được công dụng và cách sử dụng một số dụng cụ đo thông dụng (thước, bình chia độ, cân, nhiệt kế), kính lúp và kính hiển vi quang học." },
        { "muc_do": "TH", "noi_dung": "Phân biệt được vật sống và vật không sống dựa vào các đặc điểm đặc trưng: trao đổi chất và chuyển hoá năng lượng, lớn lên, sinh sản, cảm ứng." },
        { "muc_do": "TH", "noi_dung": "Xác định được giới hạn đo (GHĐ) và độ chia nhỏ nhất (ĐCNN) của dụng cụ đo; lựa chọn được dụng cụ đo phù hợp với phép đo." },
        { "muc_do": "TH", "noi_dung": "Giải thích được cơ sở khoa học của một số quy tắc an toàn bắt buộc trong phòng thực hành." },
        { "muc_do": "VD", "noi_dung": "Xử lí được một số tình huống mất an toàn thường gặp trong phòng thực hành; tính được độ phóng đại của kính hiển vi quang học." }
      ]
    },
    {
      "chu_de": "Chủ đề 2. Đa dạng chất. Các thể của chất",
      "yeu_cau": [
        { "muc_do": "NB", "noi_dung": "Nêu được sự đa dạng của chất; chất có ở xung quanh ta, trong mọi vật thể tự nhiên và vật thể nhân tạo." },
        { "muc_do": "NB", "noi_dung": "Nêu được ba thể (trạng thái) cơ bản của chất: rắn, lỏng, khí kèm ví dụ minh hoạ ở điều kiện thường." },
        { "muc_do": "NB", "noi_dung": "Nêu được khái niệm về sự nóng chảy, sự đông đặc, sự bay hơi, sự ngưng tụ, sự sôi và các mốc nhiệt độ chuyển thể của nước." },
        { "muc_do": "TH", "noi_dung": "Trình bày và so sánh được đặc điểm về hình dạng, thể tích, khả năng bị nén, khả năng lan truyền của chất ở thể rắn, lỏng, khí." },
        { "muc_do": "TH", "noi_dung": "Phân biệt được vật thể tự nhiên – vật thể nhân tạo, vật hữu sinh – vật vô sinh; xác định được quá trình chuyển thể trong một hiện tượng cụ thể." },
        { "muc_do": "VD", "noi_dung": "Vận dụng đặc điểm các thể của chất để dự đoán, giải thích kết quả khi chuyển một lượng chất sang vật chứa có hình dạng khác." },
        { "muc_do": "LH", "noi_dung": "Giải thích được các hiện tượng chuyển thể của nước trong đời sống (trời nồm, sương mù, giọt nước bám ngoài thành cốc nước đá) và đề xuất được biện pháp ứng phó phù hợp với gia đình, địa phương." }
      ]
    }
  ],

  "dang_bai_tap": [
    {
      "loai": 1,
      "mo_ta": "Mỗi câu nêu 1 vấn đề, cho 4 phương án A, B, C, D; thí sinh chọn duy nhất 1 phương án đúng. Các phương án nhiễu phải hợp lí, cùng trường ngữ nghĩa, tránh phương án quá dài hoặc lộ đáp án.",
      "dang": [
        { "ma": "1.1", "ten": "Nhận diện khái niệm, đối tượng và lĩnh vực của khoa học tự nhiên", "muc_do": "NB", "mo_ta": "Cho một khái niệm hoặc một hoạt động, yêu cầu chọn định nghĩa đúng hoặc chỉ ra lĩnh vực/ngành không thuộc KHTN.", "vi_du": "Lĩnh vực nào sau đây không thuộc khoa học tự nhiên?" },
        { "ma": "1.2", "ten": "Nhận diện dụng cụ đo, quy tắc an toàn và kí hiệu cảnh báo", "muc_do": "NB", "mo_ta": "Gắn tên dụng cụ với công dụng (đo chiều dài, thể tích, khối lượng, nhiệt độ) hoặc gắn kí hiệu cảnh báo với ý nghĩa.", "vi_du": "Dụng cụ nào dùng để đo thể tích chất lỏng trong phòng thực hành?" },
        { "ma": "1.3", "ten": "Nhận diện vật thể tự nhiên – nhân tạo, vật sống – vật không sống, thể của chất", "muc_do": "NB", "mo_ta": "Cho danh sách vật thể/chất quen thuộc, yêu cầu chọn đúng nhóm phân loại hoặc thể tồn tại ở điều kiện thường." },
        { "ma": "1.4", "ten": "So sánh – phân biệt đặc điểm ba thể của chất", "muc_do": "TH", "mo_ta": "Cho một đặc điểm (hình dạng, thể tích, khả năng nén, khả năng lan truyền), yêu cầu xác định thể tương ứng." },
        { "ma": "1.5", "ten": "Xác định GHĐ – ĐCNN và đọc kết quả đo", "muc_do": "TH", "mo_ta": "Cho thông số ghi trên dụng cụ đo, yêu cầu chỉ ra ý nghĩa của từng số hoặc chọn dụng cụ đo phù hợp." },
        { "ma": "1.6", "ten": "Gọi tên quá trình chuyển thể trong một hiện tượng thực tế", "muc_do": "TH", "mo_ta": "Cho một hiện tượng đời sống (sương đọng, nước đá tan, quần áo khô…), yêu cầu chỉ ra quá trình chuyển thể tương ứng." }
      ]
    },
    {
      "loai": 2,
      "mo_ta": "Mỗi câu cho một ngữ cảnh/dữ kiện chung và 4 nhận định a), b), c), d); thí sinh xác định từng nhận định là Đúng hay Sai. Số ý đúng trong mỗi câu nên khác nhau; 4 ý nên phủ nhiều mức độ tăng dần trong cùng một đơn vị kiến thức.",
      "dang": [
        { "ma": "2.1", "ten": "Chùm nhận định về nội quy và an toàn phòng thực hành", "muc_do": "NB", "mo_ta": "Trộn các quy tắc đúng với các thao tác sai điển hình (nếm/ngửi trực tiếp hoá chất, đổ hoá chất thừa lại lọ, hướng miệng ống nghiệm về phía người)." },
        { "ma": "2.2", "ten": "Chùm nhận định về đặc điểm ba thể của chất", "muc_do": "TH", "mo_ta": "Cho 2–3 chất cụ thể ở điều kiện thường, các ý đi từ nhận biết thể → so sánh đặc điểm → dự đoán kết quả khi đổi vật chứa." },
        { "ma": "2.3", "ten": "Chùm nhận định về các quá trình chuyển thể", "muc_do": "NB", "mo_ta": "Kiểm tra định nghĩa nóng chảy/đông đặc/bay hơi/ngưng tụ, kèm 1 ý vận dụng bác bỏ cách giải thích sai về hiện tượng thực tế." },
        { "ma": "2.4", "ten": "Chùm nhận định về lĩnh vực KHTN và vật sống – vật không sống", "muc_do": "TH", "mo_ta": "Kết hợp nhận biết các lĩnh vực KHTN với việc phân biệt vật sống dựa trên dấu hiệu đặc trưng, có ý gài bẫy (ngọn nến, tinh thể muối lớn lên)." }
      ]
    },
    {
      "loai": 3,
      "mo_ta": "Câu hỏi mà đáp án là một con số (kèm đơn vị nếu có). Yêu cầu phép tính đơn giản, dữ kiện rõ ràng, chỉ có duy nhất một giá trị đúng.",
      "dang": [
        { "ma": "3.1", "ten": "Tính độ phóng đại của kính hiển vi quang học", "muc_do": "NB", "mo_ta": "Độ phóng đại = số bội giác vật kính × số bội giác thị kính.", "vi_du": "Vật kính 40x, thị kính 10x → độ phóng đại 400 lần." },
        { "ma": "3.2", "ten": "Đọc và tính kết quả đo (thể tích, khối lượng, nhiệt độ)", "muc_do": "TH", "mo_ta": "Cho mực chất lỏng trước và sau khi thả vật, hoặc số chỉ trên cân, yêu cầu tính giá trị cần đo." },
        { "ma": "3.3", "ten": "Tính khoảng nhiệt độ tồn tại của một thể", "muc_do": "TH", "mo_ta": "Từ nhiệt độ nóng chảy và nhiệt độ sôi, tính độ rộng khoảng nhiệt độ mà chất tồn tại ở thể lỏng." },
        { "ma": "3.4", "ten": "Đếm số đối tượng thoả mãn một tiêu chí phân loại", "muc_do": "NB", "mo_ta": "Cho danh sách vật thể/chất, đếm số vật thể tự nhiên, vật sống hoặc số chất ở thể khí." }
      ]
    },
    {
      "loai": 4,
      "mo_ta": "Câu hỏi yêu cầu trình bày, giải thích, phân loại hoặc đề xuất giải pháp. Nên chia thành các ý a), b) với thang điểm rõ ràng để dễ chấm và bảo đảm đúng mức độ đã thiết kế trong ma trận.",
      "dang": [
        { "ma": "4.1", "ten": "Trình bày và giải thích cơ sở của quy tắc an toàn phòng thực hành", "muc_do": "TH", "mo_ta": "Không dừng ở việc kể tên quy tắc mà phải nêu được lí do khoa học/hậu quả nếu vi phạm." },
        { "ma": "4.2", "ten": "Phân loại vật thể – chất và giải thích bằng đặc điểm các thể", "muc_do": "VD", "mo_ta": "Cho tình huống chuyển chất sang vật chứa khác, yêu cầu dự đoán hình dạng – thể tích và lí giải." },
        { "ma": "4.3", "ten": "Giải thích hiện tượng chuyển thể trong đời sống và đề xuất biện pháp", "muc_do": "LH", "mo_ta": "Bám vào hiện tượng có thật ở địa phương (trời nồm, sương mù, bảo quản thực phẩm), yêu cầu 2 biện pháp kèm cơ sở khoa học." },
        { "ma": "4.4", "ten": "Mô tả thí nghiệm đơn giản theo dõi sự chuyển thể", "muc_do": "VD", "mo_ta": "Nêu dụng cụ, các bước tiến hành, cách ghi số liệu và dự đoán dạng đồ thị nhiệt độ – thời gian khi đun nóng chảy nước đá." }
      ]
    }
  ],

  "de_minh_hoa": {
    "cau_truc": "Cấu trúc đề: 12 câu loại 1 (3,0 điểm) – 4 câu loại 2 gồm 16 ý (4,0 điểm) – 2 câu loại 3 (1,0 điểm) – 3 câu loại 4 gồm 6 ý a), b) (2,0 điểm). Tổng 33 lệnh hỏi, 10,0 điểm; tỉ lệ Nhận biết : Thông hiểu : Vận dụng : Liên hệ thực tế = 50% : 30% : 10% : 10%.",
    "phan": [
      {
        "ten": "PHẦN I. TRẮC NGHIỆM NHIỀU LỰA CHỌN (12 câu – 3,0 điểm)",
        "huong_dan": "Thí sinh trả lời từ câu 1 đến câu 12. Mỗi câu hỏi thí sinh chỉ chọn một phương án. Mỗi câu trả lời đúng được 0,25 điểm.",
        "loai": 1,
        "cau": [
          {
            "stt": 1, "loai": 1, "muc_do": "NB", "dang": "1.1", "diem": 0.25,
            "chu_de": "Mở đầu về Khoa học tự nhiên",
            "don_vi": "1.1. Giới thiệu về Khoa học tự nhiên. Các lĩnh vực chủ yếu của KHTN. Vật sống – vật không sống",
            "de": "Khoa học tự nhiên nghiên cứu về đối tượng nào sau đây?",
            "lua_chon": [
              "Các sự vật, hiện tượng và quy luật của thế giới tự nhiên",
              "Sự hình thành và phát triển của xã hội loài người",
              "Các quy tắc ứng xử giữa người với người",
              "Các tác phẩm hội hoạ và âm nhạc"
            ],
            "dap_an": "A",
            "loi_giai": "Khoa học tự nhiên là ngành khoa học nghiên cứu các sự vật, hiện tượng, quy luật của tự nhiên cùng ảnh hưởng của chúng đến cuộc sống con người và môi trường."
          },
          {